<?xml version="1.0" encoding="UTF-8"?>
<!--
	Copyright (C) 2006-2007 Mindquarry GmbH, All Rights Reserved
	
	The contents of this file are subject to the Mozilla Public License
	Version 1.1 (the "License"); you may not use this file except in
	compliance with the License. You may obtain a copy of the License at
	http://www.mozilla.org/MPL/
	
	Software distributed under the License is distributed on an "AS IS"
	basis, WITHOUT WARRANTY OF ANY KIND, either express or implied. See the
	License for the specific language governing rights and limitations
	under the License.
-->
<configuration
	xmlns="http://www.mindquarry.com/ns/schema/xmlbeans-persistence"
	xmlns:xsi="http://www.w3.org/2001/XMLSchema-instance"
	xsi:schemaLocation="http://www.mindquarry.com/ns/schema/xmlbeans-persistence ../../../../../../main/xsd/xmlbeans-persistence.xsd ">
	<entity>
		<className>com.mindquarry.persistence.mock.UserEntity</className>
		<path>not necessary in mock implementation</path>
	</entity>
	<entity>
		<className>com.mindquarry.persistence.mock.TeamspaceEntity</className>
		<path>not necessary in mock implementation</path>
	</entity>
	<queryInfo>
		<key>getUserById</key>
		<query>byId</query>
		<resultEntityClass>com.mindquarry.persistence.mock.UserEntity</resultEntityClass>
	</queryInfo>
	<queryInfo>
		<key>getAllUsers</key>
		<query>byClass</query>
		<resultEntityClass>com.mindquarry.persistence.mock.UserEntity</resultEntityClass>
	</queryInfo>
	<queryInfo>
		<key>getTeamspaceById</key>
		<query>/teamspaces/{$id}/metadata.xml</query>
		<resultEntityClass>com.mindquarry.persistence.mock.TeamspaceEntity</resultEntityClass>
	</queryInfo>
	<queryInfo>
		<key>getAllTeamspaces</key>
		<query>/teamspaces</query>
		<resultEntityClass>com.mindquarry.persistence.mock.TeamspaceEntity</resultEntityClass>
	</queryInfo>
</configuration>
